{
  "action_id": "action-valid-release",
  "artifacts": {
    "calibrations": [
      {
        "digest": "sha256:a0f76c1c73b1beed6dff52fa6006754a704bf6f7d19adc98742bfb0e169bd1e0",
        "path": "calibrations/cal-1.json"
      }
    ],
    "edges": [
      {
        "digest": "sha256:6d93de7539ac8a50249cd046eb1bf9964aa00c3e28878380ad994edd70f50c7d",
        "path": "edges/edge-admissibility_decision-to-review.json"
      },
      {
        "digest": "sha256:f2749ca4de0b0f583f0fe3685f32b017f03b3d9ee75ae36be369bf9c7dfecfd2",
        "path": "edges/edge-claim-to-proposed_action.json"
      },
      {
        "digest": "sha256:8cba379da3df24a87e84557af4dcde5895af978a15ee85ecbc833192194c2391",
        "path": "edges/edge-evidence-to-claim.json"
      },
      {
        "digest": "sha256:0627ec07d4fe93d5896a0a38677f898e850b63100fcfc544ca5e0cbe46e06316",
        "path": "edges/edge-grant-to-runtime_action.json"
      },
      {
        "digest": "sha256:f9ac2a256f918010f06cf249824336240090568e104e183dbba11684250c25e2",
        "path": "edges/edge-outcome-to-calibration.json"
      },
      {
        "digest": "sha256:a01671f710ef543a20ea44b909b813004131d40ccbfb5fac822592b1b49c6d75",
        "path": "edges/edge-proposed_action-to-admissibility_decision.json"
      },
      {
        "digest": "sha256:dc646fe5ef473ea463c48402fac5d045061ceec5d6d2cd9b600d30b3e9983317",
        "path": "edges/edge-review-to-grant.json"
      },
      {
        "digest": "sha256:3c6124b1166c57c3061d20898319d7e0a76a5fc9a265be5c67dcf4cd6bbfd35b",
        "path": "edges/edge-runtime_action-to-verification_result.json"
      },
      {
        "digest": "sha256:3f326330cf24070c46e24bbf7c9f1193ab7c5a97753b2b1a9180e0c9f093c3c1",
        "path": "edges/edge-source-to-evidence.json"
      },
      {
        "digest": "sha256:fdf0816e3e7d86bf74835a0206143b3379b34d66d7ca35491b38f997a0d131a9",
        "path": "edges/edge-verification_result-to-outcome.json"
      }
    ],
    "execution": [
      {
        "digest": "sha256:cc5ea848f10bdcb0baa2b2100db6719faf874e57371e8743e7f8f16183fcff6f",
        "path": "execution/execution.json"
      }
    ],
    "nodes": [
      {
        "digest": "sha256:d76c8a517989b68caa9a70254638d42fe35be3f249c90b949f97d9ca7e13985d",
        "path": "nodes/node-admissibility_decision.json"
      },
      {
        "digest": "sha256:58645acadb3aa267985d2428d3e4db9e81d7572dd14470b983729312c59e8abc",
        "path": "nodes/node-calibration-cal-1.json"
      },
      {
        "digest": "sha256:f99871dbd996116391f19728a2129425113b73f77589f23abf0654432384944b",
        "path": "nodes/node-claim.json"
      },
      {
        "digest": "sha256:146eb80ad9d89c82013b8ec480b5b55c3c6623969771dbc478cf9cb52d29bd03",
        "path": "nodes/node-evidence.json"
      },
      {
        "digest": "sha256:2c77cc4cafe8d7c4d29c67430b37d505ff4a1904f0396c93d7fa90c231e1e709",
        "path": "nodes/node-grant.json"
      },
      {
        "digest": "sha256:90893b71440e29025a091a1fdde9fdddfbff8c0b3acd2fbe0611d0fefd187492",
        "path": "nodes/node-outcome-outcome-1.json"
      },
      {
        "digest": "sha256:4b7ce9b05166b3037f8b2e3a87b0307b255b9545111ee267c4bc7d432f8079d1",
        "path": "nodes/node-proposed_action.json"
      },
      {
        "digest": "sha256:67561a7db2d9d436d972a48828e0b3bb00a616ca6777479f6d27331302a39bf5",
        "path": "nodes/node-review.json"
      },
      {
        "digest": "sha256:9208b77de183e10fa3dcd32a3af182d473f54d5a1e1be9c4e4ffa5e3375ea873",
        "path": "nodes/node-runtime_action.json"
      },
      {
        "digest": "sha256:5a419b9db4734bdf20d6e4abbc0e615dc95efff7956ca2aefcc199d29a43786f",
        "path": "nodes/node-source.json"
      },
      {
        "digest": "sha256:3e58a48bfd66b295b18e2930e313f584b4c81f7c9ceb4e5ee50fee6aeac69199",
        "path": "nodes/node-verification_result.json"
      }
    ],
    "outcomes": [
      {
        "digest": "sha256:3bb59c4601a0e775d224c16d2b91bbdd21d0e5d3e49e7da543db754e822483e3",
        "path": "outcomes/outcome-1.json"
      }
    ],
    "pcs": {
      "bundle_path": null,
      "claim_pointers": [],
      "mode": "none"
    },
    "refs": []
  },
  "checksums_path": "checksums.txt",
  "created_at": "2026-07-01T00:00:00Z",
  "lifecycle": "admissible_for_import",
  "notes": "Synthetic assurance release",
  "producer": "assurance-fixture",
  "release_id": "valid-release-v0",
  "schema_version": "v1"
}
