{
  "action_id": "action-pilot-retrospective",
  "artifacts": {
    "calibrations": [
      {
        "digest": "sha256:486df359b155af0d1658add018dae25d3279a5ed70d0340791b5ffc3e1a471f4",
        "path": "calibrations/cal-1.json"
      }
    ],
    "edges": [
      {
        "digest": "sha256:e6176b8254bc9c2ba5b1cdf93622f411ddcd71c284ef6cac6d7c3c8586014408",
        "path": "edges/edge-admissibility_decision-to-review.json"
      },
      {
        "digest": "sha256:f331785f9e35f046a36acfe14f41ca2f0fdd043a1e36892583508c303ecff74a",
        "path": "edges/edge-claim-to-proposed_action.json"
      },
      {
        "digest": "sha256:c0773d22048a4ecf5ceda6d48342dcd3bb85aaf436a6f38d53cf42d2d94f1f5d",
        "path": "edges/edge-evidence-to-claim.json"
      },
      {
        "digest": "sha256:8b52bc8d137ee2bc78643cf893388c0a566d9c5cf00828e65b911cc368cf84fd",
        "path": "edges/edge-grant-to-runtime_action.json"
      },
      {
        "digest": "sha256:103d67ad6d59d391cfdc21210f8a9cbc4993c342453ccceb13d0062a106aaea0",
        "path": "edges/edge-outcome-to-calibration.json"
      },
      {
        "digest": "sha256:c434ca6386e433797eb1321cfd556789691005162eb2837dcb11d71ea672a3bf",
        "path": "edges/edge-proposed_action-to-admissibility_decision.json"
      },
      {
        "digest": "sha256:637d05be3c6c1e41936a50769ebce7c01ba7077382ade42a4b98fd05b4087a85",
        "path": "edges/edge-review-to-grant.json"
      },
      {
        "digest": "sha256:a5516d479652bc3d7cdd60387cd41801f6c23da9aac2f031c42ac018d75d86f6",
        "path": "edges/edge-runtime_action-to-verification_result.json"
      },
      {
        "digest": "sha256:8488a373cb6e4c0e3acf7b53afc79eb4491fe21bd3e50636c7e37708560af29e",
        "path": "edges/edge-source-to-evidence.json"
      },
      {
        "digest": "sha256:77190bfc44c85e81f742e74c9873e9fc9be44dbeaff1e9fe197c9185a1907d49",
        "path": "edges/edge-verification_result-to-outcome.json"
      }
    ],
    "execution": [
      {
        "digest": "sha256:cc5ea848f10bdcb0baa2b2100db6719faf874e57371e8743e7f8f16183fcff6f",
        "path": "execution/execution.json"
      }
    ],
    "nodes": [
      {
        "digest": "sha256:d86136009fcfbf5b662f9aca14dca1d85ff31794f8d7b0b0040b1a816277caea",
        "path": "nodes/node-admissibility_decision.json"
      },
      {
        "digest": "sha256:7a8cd9ec1e0aacd94429db51b6fd7fee2906c27949d3e0c1320db7d628e81486",
        "path": "nodes/node-calibration-cal-1.json"
      },
      {
        "digest": "sha256:22c5af55b5d07db002da7dcd159e1b7754a38ecafc22644283d15f246ea21a89",
        "path": "nodes/node-claim.json"
      },
      {
        "digest": "sha256:a3bffe060850257f4f0bbcf42f005b74a0bdf367332a91b0065c73e1c358ac85",
        "path": "nodes/node-evidence.json"
      },
      {
        "digest": "sha256:10d8482f6289c7f00509524409b8b63806fc092576ac0a6224224437087722de",
        "path": "nodes/node-grant.json"
      },
      {
        "digest": "sha256:cb641da0ec20b32714b8f4797d8fe460d8dfc69a1c138d7c1bf847439613abc0",
        "path": "nodes/node-outcome-outcome-1.json"
      },
      {
        "digest": "sha256:dc13c7606413da33d420c48fafc7c5f35d7f0f2bb45a316833c7670925410aa8",
        "path": "nodes/node-proposed_action.json"
      },
      {
        "digest": "sha256:fe5545fdcf65410cd278e486fa85043a08ada5b853c2226e2c33fd86a905744a",
        "path": "nodes/node-review.json"
      },
      {
        "digest": "sha256:59149732664d6a82d19112eead333846a50ee5e55173aeff8f3694f09432ca27",
        "path": "nodes/node-runtime_action.json"
      },
      {
        "digest": "sha256:85493f699c12de4a0a2501f444f4f6ad291abf83927908a1d1b25704f696182d",
        "path": "nodes/node-source.json"
      },
      {
        "digest": "sha256:84781ae9713fc6231020c52208209fe036a670040aa601c1ec3768aeca4c8aa2",
        "path": "nodes/node-verification_result.json"
      }
    ],
    "outcomes": [
      {
        "digest": "sha256:6bc40cb164fdbbdb207478a0c7d3ae05bc3769db99612aa368fe6385058de3fb",
        "path": "outcomes/outcome-1.json"
      }
    ],
    "pcs": {
      "bundle_path": null,
      "claim_pointers": [],
      "mode": "none"
    },
    "refs": []
  },
  "checksums_path": "checksums.txt",
  "created_at": "2026-07-24T22:30:37Z",
  "lifecycle": "admissible_for_import",
  "notes": "Portable action-chain export",
  "producer": "sm_pipeline.assurance.export",
  "release_id": "assurance-export-action-pilot-retrospective",
  "schema_version": "v1"
}
